{
  "$schema": "https://json-schema.org/draft/2020-12/schema",
  "title": "AI-7 Governed Agent Specification",
  "type": "object",
  "required": [
    "agent_id",
    "role",
    "domain",
    "allowed_actions",
    "blocked_actions",
    "inputs",
    "outputs",
    "required_evidence",
    "risk_level",
    "human_review_required"
  ],
  "properties": {
    "agent_id": {"type": "string"},
    "role": {"type": "string"},
    "domain": {"type": "string"},
    "allowed_actions": {"type": "array", "items": {"type": "string"}},
    "blocked_actions": {"type": "array", "items": {"type": "string"}},
    "inputs": {"type": "array", "items": {"type": "string"}},
    "outputs": {"type": "array", "items": {"type": "string"}},
    "tools": {"type": "array", "items": {"type": "string"}},
    "required_evidence": {"type": "array", "items": {"type": "string"}},
    "tests": {"type": "array", "items": {"type": "string"}},
    "rollback": {"type": "array", "items": {"type": "string"}},
    "risk_level": {"type": "string", "enum": ["R0", "R1", "R2", "R3", "R4"]},
    "truth_level": {"type": "string", "enum": ["T0", "T1", "T2", "T3", "T4", "T5"]},
    "human_review_required": {"type": "boolean"},
    "notes": {"type": "string"}
  },
  "additionalProperties": true
}
